{"meta": {"brand_name": "Svalbard Security Inc.", "tier": "asgard", "tier_label": "Asgard", "tier_focus": "Security-team brief — full findings, remediation, TLS & header analysis, leaked-credential watch", "plan_price": "CA$1,891/month", "plan_blurb": "Unlocks every critical and important finding with evidence and what to fix, adds TLS and header analysis, and watches the dark web for leaked credentials. Rescans this target four times a month.", "rescan_cadence": "4 rescans / month", "target": "https://acme.example.com", "scan_id": "scan-int-asgard-1", "report_id": "r-int-asgard-1", "tenant_id": "tenant-int-asgard-1", "scope": "https://acme.example.com (external, authorized)", "generated_at": "2026-04-19T10:00:00Z", "completed_at": "2026-04-19T10:00:00Z", "engagement_window": ""}, "severity_counts": {"critical": 1, "high": 2, "medium": 1, "low": 1, "info": 0}, "findings": [{"id": "", "title": "SQLi at /api/v1/users", "severity": "critical", "cwe": "CWE-89", "owasp": "A03:2021 — Injection", "cvss": 9.8, "cvss_vector": null, "asset": "", "status": "suspected", "confidence": "high", "what": "UNION-based SQLi via id parameter.", "why": "This weakness reduces the security posture of the asset and should be remediated to preserve defense-in-depth.", "evidence": "UNION-based SQLi via id parameter.", "negative_control": null, "remediation": ["Use parameterized queries / prepared statements (or the ORM's bound-parameter API) for every query that consumes request input — never string-concatenate request input into SQL.", "Validate and canonicalize the input server-side and reject non-conforming values before they reach the data layer.", "Run the application's database account with least privilege (no DDL, no access to unrelated schemas)."], "validation": "Re-test the finding after the fix and confirm the weakness no longer reproduces."}, {"id": "", "title": "Reverse shell PoC in /upload", "severity": "high", "cwe": "CWE-78", "owasp": "A01:2021 — Broken Access Control", "cvss": 8.6, "cvss_vector": null, "asset": "", "status": "suspected", "confidence": "high", "what": "File upload allows RCE; PoC included.", "why": "This weakness reduces the security posture of the asset and should be remediated to preserve defense-in-depth.", "evidence": "File upload allows RCE; PoC included.", "negative_control": null, "remediation": ["Reject non-image MIME types and run the worker as a non-root user."], "validation": "Re-test the finding after the fix and confirm the weakness no longer reproduces."}, {"id": "", "title": "GitHub PAT leaked in JS bundle", "severity": "high", "cwe": "CWE-200", "owasp": "A02:2021 — Cryptographic Failures", "cvss": 7.5, "cvss_vector": null, "asset": "", "status": "suspected", "confidence": "high", "what": "ghp_* token observed in /static/app.js.", "why": "This weakness reduces the security posture of the asset and should be remediated to preserve defense-in-depth.", "evidence": "ghp_* token observed in /static/app.js.", "negative_control": null, "remediation": ["Suppress or genericize framework banners and X-Powered-By style headers at the reverse proxy."], "validation": "Re-test the finding after the fix and confirm the weakness no longer reproduces."}, {"id": "", "title": "Missing security headers", "severity": "medium", "cwe": "CWE-693", "owasp": "A05:2021 — Security Misconfiguration", "cvss": null, "cvss_vector": null, "asset": "", "status": "suspected", "confidence": "high", "what": "No CSP / HSTS / X-Frame-Options.", "why": "This weakness reduces the security posture of the asset and should be remediated to preserve defense-in-depth.", "evidence": "No CSP / HSTS / X-Frame-Options.", "negative_control": null, "remediation": ["Deploy a Content-Security-Policy that pins allowed script/style origins; start in Content-Security-Policy-Report-Only, review reports, then enforce.", "Add Strict-Transport-Security: max-age=31536000; includeSubDomains once every endpoint is served over HTTPS.", "Set Referrer-Policy: strict-origin-when-cross-origin and a least-privilege Permissions-Policy."], "validation": "Re-test the finding after the fix and confirm the weakness no longer reproduces."}, {"id": "", "title": "MySQL root password observed in CI script", "severity": "low", "cwe": "CWE-798", "owasp": "A07:2021 — Identification and Authentication Failures", "cvss": null, "cvss_vector": null, "asset": "", "status": "suspected", "confidence": "medium", "what": "Hardcoded password in deploy script.", "why": "This weakness reduces the security posture of the asset and should be remediated to preserve defense-in-depth.", "evidence": "Hardcoded password in deploy script.", "negative_control": null, "remediation": ["Context-encode all untrusted output (HTML/attribute/JS/URL) and prefer framework auto-escaping.", "Deploy a Content-Security-Policy that pins allowed script origins as a second line of defense."], "validation": "Re-test the finding after the fix and confirm the weakness no longer reproduces."}], "tls_analysis": {"summary": "TLS posture could not be assessed for the scanned endpoint (no TLS data collected).", "rows": [{"check": "Transport", "result": "not assessed", "status": "not assessed", "detail": "No transport data collected."}, {"check": "Negotiated protocol", "result": "not assessed", "status": "not assessed", "detail": "No protocol negotiated."}, {"check": "Certificate chain", "result": "not assessed", "status": "not assessed", "detail": "No certificate observed."}, {"check": "HSTS", "result": "not assessed", "status": "not assessed", "detail": "Strict-Transport-Security header not set (see headers section)."}], "remediation": ["Terminate TLS in front of the service (reverse proxy or load balancer) and serve only TLS 1.2+ with an ECDHE/AEAD cipher suite.", "Redirect HTTP to HTTPS and add HSTS once every endpoint is HTTPS-ready.", "Automate certificate issuance and renewal; keep the chain current."]}, "header_analysis": {"summary": "Security-relevant response headers were not captured for this target; review is pending.", "rows": [{"header": "Content-Security-Policy", "present": false, "recommended": "Pin allowed script/style origins; report-only first, then enforce."}, {"header": "Strict-Transport-Security", "present": false, "recommended": "max-age=31536000; includeSubDomains once HTTPS-ready."}, {"header": "Referrer-Policy", "present": false, "recommended": "strict-origin-when-cross-origin."}, {"header": "Permissions-Policy", "present": false, "recommended": "Deny unused browser features (geolocation, camera, etc.)."}, {"header": "X-Content-Type-Options", "present": false, "recommended": "nosniff — keep."}, {"header": "X-Frame-Options", "present": false, "recommended": "SAMEORIGIN — keep (or fold into CSP frame-ancestors)."}]}, "dark_web": {"summary": "Leaked-credential monitoring watches the target domain against breach and paste corpora and dark-web dumps. This run found no newly exposed credentials for the monitored domain. Monitoring continues between the four monthly rescans; counts only are shown here and full records are delivered to the security team through the evidence locker, never in plaintext in this document.", "monitored_domain": "acme.example.com", "sources_checked": "Public breach corpora, paste sites, credential-dump feeds", "new_exposures": 0, "total_tracked": 0, "last_checked": "2026-04-19T10:00:00Z", "rows": []}, "owasp_alignment": [{"category": "A01:2021 — Broken Access Control", "count": 1}, {"category": "A02:2021 — Cryptographic Failures", "count": 1}, {"category": "A03:2021 — Injection", "count": 1}, {"category": "A05:2021 — Security Misconfiguration", "count": 1}, {"category": "A07:2021 — Identification and Authentication Failures", "count": 1}], "ai_conclusions": {"vulnerability_description": "LLM exec summary", "business_risk": "Prioritise the critical and high-severity findings: together they represent the shortest path to account or data compromise, and the configuration gaps remove the defense-in-depth that would otherwise contain their impact.", "prioritized_roadmap": ["Now — remediate every critical and high-severity finding.", "This sprint — close the medium-severity configuration and transport gaps (TLS, security headers, rate limiting).", "This quarter — publish the missing email-authentication and DNS-integrity records and move DMARC toward enforcement."]}}